{"development_only":true,"development_status":"PASS","events":[{"authorization_hash":"cffe47ffca2aa4581b9958f191278ccae80d3d9b738bd514f70a0fe92f6b055b","development_only":true,"entry_hash":"2b335ec65c542b5eca2a9931c1e5b9e40ada4b429f750bd6e095dce530da9c33","event":"PURGE_INTENT","manifest_hash":"c4e56ed2826fef88ff21d3d740a40f93f03ce3ad64a520978c0573f381b8f6b4","operation_id":"530e1c6da61b28c6baa06bb61152c9e9a4f847ad494bc3f8af0549585cb3d90e","plan_hash":"d8d317ba5ada463adbe71465fcf587656153c422c6fcb6b4543f6df5af907a81","prev_hash":"","version":2},{"entry_hash":"238cc956d1046bd09e84a6f770ce31e182670e2b98c99d17f37636963756d92f","event":"UNLINK_INTENT","expected_lstat":{"allocated_bytes":512,"dev":1246154315,"ino":13229323905569233,"sha256":"1932ffa4a588f1179fb6e99c2af5142006d1642145bd8fa806411c867bb71c28","size":23},"operation_id":"530e1c6da61b28c6baa06bb61152c9e9a4f847ad494bc3f8af0549585cb3d90e","path":"ephemeral/bundle.bin","plan_hash":"d8d317ba5ada463adbe71465fcf587656153c422c6fcb6b4543f6df5af907a81","prev_hash":"2b335ec65c542b5eca2a9931c1e5b9e40ada4b429f750bd6e095dce530da9c33","version":2},{"entry_hash":"b1bcae1879e3af7fbba70159df0775089638b28117598216e672dde7be8829a7","event":"UNLINK","operation_id":"530e1c6da61b28c6baa06bb61152c9e9a4f847ad494bc3f8af0549585cb3d90e","path":"ephemeral/bundle.bin","plan_hash":"d8d317ba5ada463adbe71465fcf587656153c422c6fcb6b4543f6df5af907a81","prev_hash":"238cc956d1046bd09e84a6f770ce31e182670e2b98c99d17f37636963756d92f","recovered_missing_after_intent":false,"version":2},{"entry_hash":"cbabccdb1144f5e78666e8bd4d31a0fbeaa335d974621d0a176d4047615f8530","event":"UNLINK_INTENT","expected_lstat":{"allocated_bytes":512,"dev":1246154315,"ino":113434415614563882,"sha256":"1ac9bf04d1acd98da45b36cc0c563eed634eea3368ad3feba79096a219bea7db","size":22},"operation_id":"530e1c6da61b28c6baa06bb61152c9e9a4f847ad494bc3f8af0549585cb3d90e","path":"scratch/cache.tmp","plan_hash":"d8d317ba5ada463adbe71465fcf587656153c422c6fcb6b4543f6df5af907a81","prev_hash":"b1bcae1879e3af7fbba70159df0775089638b28117598216e672dde7be8829a7","version":2},{"entry_hash":"4f078d0d5188187e8f249f2c459ae3677cd67b6ad737a16a2e37b7ef18095d1b","event":"UNLINK","operation_id":"530e1c6da61b28c6baa06bb61152c9e9a4f847ad494bc3f8af0549585cb3d90e","path":"scratch/cache.tmp","plan_hash":"d8d317ba5ada463adbe71465fcf587656153c422c6fcb6b4543f6df5af907a81","prev_hash":"cbabccdb1144f5e78666e8bd4d31a0fbeaa335d974621d0a176d4047615f8530","recovered_missing_after_intent":false,"version":2},{"deleted_count":2,"entry_hash":"bcd6bf49b1ffb4122e453f7901ce98d2c217d2bd5e14bb7d9689619bb85d31ef","event":"PURGE_COMMITTED","manifest_hash":"c4e56ed2826fef88ff21d3d740a40f93f03ce3ad64a520978c0573f381b8f6b4","operation_id":"530e1c6da61b28c6baa06bb61152c9e9a4f847ad494bc3f8af0549585cb3d90e","plan_hash":"d8d317ba5ada463adbe71465fcf587656153c422c6fcb6b4543f6df5af907a81","prev_hash":"4f078d0d5188187e8f249f2c459ae3677cd67b6ad737a16a2e37b7ef18095d1b","version":2}],"ledger_head":"bcd6bf49b1ffb4122e453f7901ce98d2c217d2bd5e14bb7d9689619bb85d31ef","live_status":"PENDING","local_live_gate_passed":false,"manifest_hash":"c4e56ed2826fef88ff21d3d740a40f93f03ce3ad64a520978c0573f381b8f6b4","plan_hash":"d8d317ba5ada463adbe71465fcf587656153c422c6fcb6b4543f6df5af907a81","schema_version":"dataset-purge-ledger-document.v2","segment_id":"DEV-G004-SEGMENT-001","version":2}
